{
  "$schema": "https://json-schema.org/draft/2020-12/schema",
  "title": "task.orchestrate.requested",
  "type": "object",
  "required": ["tenant_id", "project", "correlation_id"],
  "properties": {
    "tenant_id": { "type": "string" },
    "project": { "type": "string" },
    "correlation_id": { "type": "string" },
    "pipeline": { "type": "string" },
    "payload": { "type": "object" }
  },
  "additionalProperties": true
}
